<?xml version="1.0" encoding="ISO-8859-1"?>
<!DOCTYPE discografica SYSTEM "discografica.dtd">
<discografica>
    <disco>
        <titulo></titulo>
        <interpretes></interpretes>
        <numero_pistas></numero_pistas>
    </disco>
    <interprete>
        <nombre></nombre>
        <apellidos></apellidos>
        <rol></rol>
    </interprete>
    <pista>
        <nombre></nombre>
        <duracion></duracion>
    </pista>
</discografica>